{
  "$schema": "https://json-schema.org/draft/2020-12/schema",
  "$id": "https://iranux.org/schemas/iranux-certification-v1.0.schema.json",
  "title": "Iranux Certification v1.0",
  "description": "The IRANUX_CERTIFICATION block written only by the official Iranux Validator. Field names match the Iranux runner (IranuxCertification) exactly. A block that validates against this schema is not thereby verified: the hash and signature must also check out (specification v1.2 section 13).",
  "type": "object",
  "additionalProperties": false,
  "required": [
    "validator_version",
    "schema_version",
    "timestamp",
    "script_hash",
    "hash_algorithm",
    "signature",
    "signature_key_id"
  ],
  "properties": {
    "validator_version": {
      "type": "string",
      "pattern": "^\\d+\\.\\d+\\.\\d+(?:-[0-9A-Za-z.-]+)?$"
    },
    "schema_version": { "const": "1.0" },
    "timestamp": {
      "type": "string",
      "pattern": "^\\d{4}-\\d{2}-\\d{2}T\\d{2}:\\d{2}:\\d{2}Z$"
    },
    "script_hash": {
      "type": "string",
      "pattern": "^[0-9a-f]{64}$"
    },
    "hash_algorithm": { "const": "sha256" },
    "signature": {
      "type": "string",
      "pattern": "^[0-9a-f]+$",
      "minLength": 768
    },
    "signature_key_id": {
      "type": "string",
      "pattern": "^iranux-[0-9]{4}-[0-9]{2}$"
    }
  }
}
