{
  "validator_version": "1.0.0",
  "schema_version": "1.0",
  "timestamp": "2026-10-07T12:00:00Z",
  "script_hash": "0000000000000000000000000000000000000000000000000000000000000000",
  "hash_algorithm": "sha256",
  "signature": "000000000000000000000000000000000000000000000000000000000000000000000000000000000000000000000000000000000000000000000000000000000000000000000000000000000000000000000000000000000000000000000000000000000000000000000000000000000000000000000000000000000000000000000000000000000000000000000000000000000000000000000000000000000000000000000000000000000000000000000000000000000000000000000000000000000000000000000000000000000000000000000000000000000000000000000000000000000000000000000000000000000000000000000000000000000000000000000000000000000000000000000000000000000000000000000000000000000000000000000000000000000000000000000000000000000000000000000000000000000000000000000000000000000000000000000000000000000000000000000000000000000000000000000000000000000000000000000000",
  "signature_key_id": "iranux-2026-01"
}
